text,is_desc,url
"Volume 92, Number 3 2005 Taylor et al. 363 Revision of Ancistrocladus naphtylisoquinoline alkaloids are otherwise found only in Dioncophyllaceae (Bringmann et al., 1990; Bringmann & Pokorny, 1995; additional references cited in Lebrun & Stork, 1991). Some of these alkaloids have shown significant activity against malaria (Frangois et al., 1994) and one group of these, the michellamines produced by A. korupensis, were found to have significant inhibitory activity against the human immunodeficiency virus (HIV) (Manfredi et al., 1991; Boyd et al., 1994; Foster & Sork, 1997). However, in preclinical studies in several animal models, michellamine B was found to possess significant neurotoxicity, which precluded it being advanced into clinical trials (pers. comm., Gordon Cragg, Natural Products Branch, Developmental Therapeutics Program, National Cancer Institute, U.S.A.).",0,https://www.biodiversitylibrary.org/page/27274329
"HISTORY Wallich (1829) named Ancistrocladus in his catalogue of Indian and Southeast Asian plants. Here he listed four species from India, Sri Lanka, Burma, Malaysia, and the Andaman Islands. Ancistrocladus had been previously named by two other authors, however; Loureiro (1790) published Bembixv Lour., based on B. tectoria Lour. from what is today Vietnam, and Vahl (1810) published Wormia Vahl.
based on Wormia hamata Vahl from Sri Lanka.
Vahl’s name, however, is a later homonym of Wormia Rottb., published (Rottbgl, 1783) for a genus of plants now treated in the Dilleniaceae and thus is illegitimate and cannot be used. Bembix was validly published, but Wallich’s name was conserved over it and the Sri Lankan species was chosen as its conserved type, as listed in ICBN Appendix HLA.E3 (Greuter et al., 2000: 205). Subsequently, Endlicher (1840) published Bigamea K. Koenig ex Endl. for the Sri Lankan species. Neither Koenig nor Endlicher named any species of Bigamea, although they clearly considered there to be only one species of this genus in Sri Lanka.",0,https://www.biodiversitylibrary.org/page/27274329
"Although Planchon (1849) first: recognized the Ancistrocladaceae as a separate family, then comprising one genus with seven species from India, Sri Lanka, and southeastern Asia, Walpers (1851) first validly published this family name. This family was not recognized for several subsequent decades by most authors, who classified Ancistrocladus in a variety of other families but most often in the Dipterocarpaceae, largely because of its similar fruits.
However, the family Ancistrocladaceae was generally recognized by the end of the 19th and beginning of the 20th century (Gilg, 1895, 1925; Tieghem, 1903).",0,https://www.biodiversitylibrary.org/page/27274329
"Oliver (1868) first reported Ancistrocladus from Africa when he described A. guineensis Oliv. as a species of Dipterocarpaceae from Nigeria. Subsequently, Ancistrocladus was reported from central Africa (Léonard, 1949, 1982) and later documented in west Africa (Airy Shaw, 1949, 1950) and in east Africa (Freson, 1967; Léonard, 1984, 1986: Cheek et al., 2000).",0,https://www.biodiversitylibrary.org/page/27274329
"Tieghem (1903) reviewed Ancistrocladaceae with particular emphasis on its anatomy and recognized three genera in the family: Bigamea, distinguished by having only five stamens and comprising the Ancistrocladus plants found in Sri Lanka, which he treated as two species; Ancistrella Tiegh., distinguished primarily by anatomical details and comprising one African species, Ancistrella barteri Tiegh.: and Ancistrocladus, comprising, the remaining species including the one other African species known to Tieghem, Ancistrocladus guineensis.
Tieghem knew Ancistrella barteri only from one sterile collection, but considered it distinct from Ancistrocladus due to its larger and apically more acute leaves, its different arrangement of fiber bundles in the leaf midrib, and its distinctive stem epidermal structure, composed of parallel-elongate cells that lack chlorophyll and have thick but nonlignified walls.",0,https://www.biodiversitylibrary.org/page/27274329
"Gilg (1895, 1925), however, treated all these species in one genus, though in his second review of the family (Gilg, 1925) he separated the Sri Lankan plants in Ancistrocladus sect. Bigamea (K.
Koenig ex Endl.) Gilg, which comprised only the section’s type species, A. hamatus (Vahl) Gilg. All the remaining species he placed in “Sect. Euancistrocladus,” which is correctly called Ancistrocladus sect. Ancistrocladus under our current rules of nomenclature (Greuter et al., 2000). Subsequent authors have agreed in placing all of the species of Ancistrocladaceae in only one genus, Ancistrocladus (Cronquist, 1981; Porembski, 2002; Stevens, 2004).",0,https://www.biodiversitylibrary.org/page/27274329
"MorRPHOLOGY HABIT Ancistrocladus species are usually found as lianas climbing high into the forest canopy by means of their distinctive lateral branches that bear several woody hooks. However, they begin life as erect, self-supporting saplings in their juvenile stage, and the climbing growth develops later from extra-axillary stems (REG, pers. obs., A. grandiflorus, A.
korupensis, A. letestui, Africa), which may at times appear to be terminal (CMT, pers. obs., A. robertMO greenhouse). These soniorum J. Léonard,",0,https://www.biodiversitylibrary.org/page/27274329
"Volume 92, Number 3 2005 Taylor et al. 375 Revision of Ancistrocladus Selected specimens examined. INDIA. West Bengal: Bengalia near Calcutta, J. W. Helfer s.n. (A, P, PNH).
MYANMAR [BURMA]. [Probably] Mon: “Singkuwm,” Tenasserim, A. Ff G. Kerr 21661] (BM).",0,https://www.biodiversitylibrary.org/page/27274341
"3. Ancistrocladus barteri Scott-Elliot, J. Linn.
Soc., Bot. 30: 73. 1894. TYPE: Sierra Leone.
Not located as to region: Mount Gonkwi, Duunia, Talla Hills, 16 Feb. 1892, G. F ScottElliot 4860 (lectotype, designated by Airy Shaw (1950: 148), K!; isotype, BM!).",0,https://www.biodiversitylibrary.org/page/27274341
"Ancistrocladus pachyrrhachis Airy Shaw, Kew Bull. 1950: 149, 1950. Syn. nov. TYPE: Liberia. Montserrado County: Monrovia, 30 May 1947, J. 7) Baldwin Jr.
5839 (holotype, K [sheet 1 of 4]!; isotypes, K [sheets 2-4. of 4]!).",0,https://www.biodiversitylibrary.org/page/27274341
"Juvenile plants very slender saplings to 2 m tall, lacking hooked branchlets. Juvenile leaves with persistence unknown, oblanceolate, 36.7—59.6 6.4— 12.0 em, L/W 4.45.0, at apex obtuse to acute, at base acute then attenuate then abruptly very shortly rounded or long-attenuate (i.e., pseudopetiolate), in life not seen, drying chartaceous, dull or shiny, discolorous, brown above, yellowish brown below: pits similar to those of adult leaves; midrib plane adaxially, thinly prominulous to prominent abaxially, with terminal gland not found; secondary veins 12 to 17 pairs; secondary and tertiary veins prominulous adaxially and abaxially; margins plane to thinly revolute. Adult stems climbing to 15 m high. to 8 mm diam. [probably becoming larger but no data]. with bark gray-brown, smooth or with shallow longitudinal fissures, bearing scattered leaves and lateral branchlets to 50 cm long, these branchlets bearing a terminal group of leaves, without hooks (e.g., Hall & Aké Assi GC-45772, GC) or with | to several hooks (e.g.. Morton & Gledhill SL 1027, WAG); hooks recurved to spiraling, 6-25 mm diam.
Adult leaves drying chartaceous to stiffly subcoriaceous, rather shiny on both surfaces, in life discolorous, dark green above, light green below, drying at least a little discolorous, dark brown above, yellow-brown below; pits dimorphic, small pits frequent to dense on both surfaces (i.e., 1 to 4 per areole formed by tertiary veins), large pits 0.1—0.3 mm diam., circular, widely scattered on both surfaces (i.e., several per leaf); midrib adaxially plane to shallowly sulcate, abaxially prominent, often terminating in a tiny gland; secondary veins prominulous on both surfaces; tertiary veins reticulated and prominulous on both surfaces; margins very thinly revolute; stem leaves with persistence unknown, elliptic to oblanceolate or narrowly obovate, 6.3-41.7 X 2.4-10.6 cm, L/W 2.6—4.6, at apex rounded to short-acuminate, at base cuneate to truncate; secondary veins 5 to 20 pairs, with submarginal vein situated 2-5 mm from margin; leaves at branchlet apices with persistence unknown, obovate to elliptic or oblanceolate, 3.5-31.4 x 1.89.4 em, L/W 2.4—4.2, at apex rounded or obtuse to acute or acuminate with acumen to 15 mm long, at base cuneate to acute then abruptly and very shortly rounded, sometimes basally narrowly long-attenuate (i.e., pseudopetiolate); secondary veins 5 to 14 pairs, with intramarginal vein situated 3-6 mm from margin. Inflorescence lax, paniculate, lateral among leaves at apices of branchlets, without hooks, sometimes with bracteal leaves similar to adult stem leaves (e.g., Aké Assi 17146, MO; Baldwin 10984, MO; Merello et al. 1301, MO): peduncle 4.0-9.5 cm long, straight to curved; branched portion corymbiform, 5—15(—24) X 7-16 em, branched 1 to 4 times dichotomously then subsequent axes racemiform: bracts ovate to triangular, 1-2. mm long. at apex acute to obtuse, at base obtuse, marginally hyaline and often erose, abaxially with a rounded gland covering %4—% of surface; pedicels 1-4 mm long. Flowers all pedicellate; sepals 5, narrowly elliptic to elliptic-oblong, rounded and entire at apex, at base cuneate to obtuse and decurrent on ovary, green sometimes with translucent veins and/or red margins, external 2 or 3 sepals abaxially with | to 4 elliptic raised glands, adaxially apparently without pits, subequal, 2.5-4.5 1.5-3.0 mm; petals 5, convolute or rarely intermediate (e.¢..
Leeuwenberg 2709, WAG), obovate, yellowish white or white tinged pink or sometimes pale violet internally and orange externally, 5.0-11.0 < 2.0-2.5 mm: stamens 9 or 10 in apparently 2 whorls, white; filaments slender, dimorphic, the shorter 1.2—2.0 mm long, the longer 2.0-4.0 mm long; anthers 0.4— 0.7 mm long: ovary fully inferior, ca. 2 mm long: styles 3, 3.0-4.5 mm long, stigmas 0.2-0.5 * 0.5— 0.8 mm. Fruit not seen.",1,https://www.biodiversitylibrary.org/page/27274341
"Distribution, phenology, and habitat. Lowland wet forests from sea level to 95 m, on coastal bluffs, along rivers, and in a laterite pit, Senegal to Ghana; collected in flower December through March, in fruit in February.",0,https://www.biodiversitylibrary.org/page/27274341
"Provisional conservation. status. With an EO greater than 20,000 km? and existing in Céte d'Ivoire (i.e., Ivory Coast), Ghana, Guinea (i.e., Guinea-Conakry), Guinea-Bissau, Liberia, Senegal, and Sierra Leone: Least Concern; Cheek (2000: 881) proposed a status of Data Deficient (DD).",0,https://www.biodiversitylibrary.org/page/27274341
"In floral characters, Ancistrocladus barteri is distinguishable from A. guineensis only by corolla aestivation, degree of dimorphism of filaments, and stamen dimensions, as outlined in the Key to Spe",0,https://www.biodiversitylibrary.org/page/27274341
"376 Annals of the Missouri Botanical Garden cies above. These two species (or geographical populations) also seem distinguishable by leaf characters: numerous obvious small pits are found throughout the leaves of A. barteri, versus few to frequent but hardly visible small pits restricted to the leaf undersurface and sometimes also isolated zones on the upper surface of the leaves of A. guineensis. However, with very few collections of these species available at anthesis, the occurrence of intermediate as well as convolute corolla aestivation in A, barteri makes their distinction somewhat tenuous. These two species are provisionally maintained here based on the characters noted above and their apparently allopatric geographic ranges, but their status will need re-evaluation when fruits are discovered for A. barteri.",0,https://www.biodiversitylibrary.org/page/27274342
"No fruiting collections can be confidently associated with Ancistrocladus barteri. Scott-Elliot (1894: 73-74) described the fruits briefly in his original description as “obpyramidale, 5-angulare, costis incrassatis, sine calycis lobis 15 mm. long.
et 15 mm. lat.” However, the specimen on which this description is based is unknown and may be among those treated here as A. abbreviatus. In his original circumscription of A. barteri, Scott-Elliot included several specimens that were subsequently excluded from A, barteri by Airy Shaw (1949), who referred most of them to his newly described species A, abbreviatus. Ancistrocladus abbreviatus does have fruits that correspond to Scott-Elliot’s description.",0,https://www.biodiversitylibrary.org/page/27274342
"Scott-Elliot (1894) did not designate a type for Ancistrocladus barteri, but listed a set of syntypes.
As noted by Gereau (1997), Airy Shaw later (1950) re-evaluated A, barteri, restricting its circumscription and selecting a lectotype, Scott-Elliot 4860 from Sierra Leone. Scott-Elliot (1894: 74) specifically listed under his A, barteri the Nigerian specimen Barter 1699, whose identity has been controversial, Airy Shaw later (1949) identified this as A.
guineensis, Keay (1954) subsequently included it in A, newly described A.",0,https://www.biodiversitylibrary.org/page/27274342
"abbreviatus, and it is here included in the abbreviatus subsp. lateralis.
This was the only Barter collection included by Scott-Elliot in this eponymous species, but Airy Shaw explicitly excluded this Barter collection from his circumscription of A, barteri without explanation. However, there are no nomenclatural grounds on which to overturn Airy Shaw’s decision.
Separately Tieghem (1903; 154) stated that Barter 1699 had characters that distinguished it from all other Ancistrocladaceae, and gave it the provisional name “Ancistrocladus barteri Tiegh.” He explained his conclusion as follows: “C’est done au bien, tout au moins, une espéce autonome, que je nommerai pour le moment A. de Barter (A. Barteri v.L.).” In the same article, Tieghem (1903: 155) also published the new genus Ancistrella Tiegh. with the single species Ancistrella barteri Tiegh., based on Barter 1699, and asserted that this second name was the one he intended to accept: “. . . on est conduit a regarder cette plante comme le type d’un genre nouveau, que je nommerai Ancistrelle (Ancistrella y.T.). Ce sera désormais l’Ancistrelle de Barter (Ancistrella Barteri v.T.).” Tieghem (1903) analyzed the leaf anatomy of Ancistrella barteri in great detail and must have derived his anatomical material from the specimen Barter 1699, which was distributed to P apparently with Scott-Elliott’s name on it. In any case Tieghem, with his particular interest in Ancistrocladus, was probably aware of the publication of Scott-Elliot’s name. Unfortunately, Tieghem (1903) was not always clear or conventional in his use of taxonomic nomenclature, so his intent is not entirely clear here. However, his use of his own initials with these names seems to indicate that his intent was indeed to separate these names from Scott-Elliot’s usage. Therefore, Tieghem’s work cannot be interpreted as a lectotypification of Scott-Elliot’s name, and the names Ancistrocladus barteri Scott-Elliot and Ancistrella barteri Tiegh. are heterotypic and independent due to the lectotypification of Ancistrocladus barteri by Airy Shaw (1950).",0,https://www.biodiversitylibrary.org/page/27274342
"As circumscribed here, Ancistrocladus barteri is variable in leaf size and shape, inflorescence size, petal size, and filament length. However, the specimens included here are linked by a continuous range of variation in these features, as discussed below. In particular, the variation in leaf form can be generally separated into several rather wellmarked groups. One group is characterized by relatively small, elliptic to obovate leaves that are obtuse to rounded at the apex and contracted in the basal portion to a narrowed, pseudopetiolate structure; specimens with such leaves have petals 6-8 mm long and the longer filaments ca. 2 mm long (these measurements are based on three flowering collections, apparently representing three plants).
A second group is characterized by its often larger, oblanceolate leaves that are acute to acuminate at the apex and uniformly narrowed to an acute base; specimens with such leaves have petals 6-11 mm long and the longer filaments ca. 4 mm long (these measurements are based on six flowering collections, representing five plants). The shortest of these petal measurements, 6 mm, is found on the type of A, barteri, which has relatively long narrow leaves with shortly acuminate apices.",1,https://www.biodiversitylibrary.org/page/27274342
Several collections of Ancistrocladus barteri com,0,https://www.biodiversitylibrary.org/page/27274342
"382 Annals of the Missouri Botanical Garden See glands, its generally well-developed pedicels, and its inflorescence bracts that are relatively small, clustered at the apices of the axes near the flower buds, apparently caducous at anthesis, and sometimes eglandular. In contrast, these other two species have outer sepals that usually have | or 2 abaxial glands, pedicels 0-3 mm long; and bracts that are often well-developed, borne regularly along all the axes, and generally persistent and usually have well-developed abaxial glands.",0,https://www.biodiversitylibrary.org/page/27274348
"The name Ancistrocladus wallichii has been frequently used for this species (e.g., Helfer 720, distributed under this name to at least three institutions; see Dagar & Singh, 1999), However, the type specimens of A. wallichii cannot be identified with certainty, and this name is here considered of dubious identity and discussed in that section, below.",0,https://www.biodiversitylibrary.org/page/27274348
"Selected specimens examined. CAMBODIA. Bois a Baba, Godefroy 285 bis (P). INDIA or MYANMAR [BURMA]. Tenasserim & Andaman Islands, Helfer 720 (A, C, P [2}). THAILAND. Bangkok, Dom Bang, Supanburi, Kerr 7006 (BM, C, E, SING). VIETNAM. Mekong River, Kratié, Chevalier 31864 (P).",0,https://www.biodiversitylibrary.org/page/27274348
"&. Ancistrocladus guineensis Oliv... FI. ‘Trop.
Afr. 1: 175. 1868. TYPE: Nigeria. Cross Rivers State: Calabar, 1859-1863, G. Mann 2234 (holotype, K!; isotypes, GH!, P!).",0,https://www.biodiversitylibrary.org/page/27274348
"Ancistrocladus uncinatus Hutch. & Dalziel, Fl. W. Trop.
Afr., ed. 1, 1: 196. 1927. Syn. nov. TYPE: Nigeria.
Akwa-Ibom State: Eket District, 1912-1913, PA, Talbot & Mrs. P. A, Talbot 3108 (holotype, K not seen; isotype, BM!).",0,https://www.biodiversitylibrary.org/page/27274348
"Juvenile plants unbranched or — sparingly branched saplings to 3m high. Juvenile leaves unknown, Adult stems climbing to 15 m high, main stems to 5 cm diam., with bark brown to purplebrown, smooth or with small shallow fissures, bearing some scattered leaves and also lateral branchlets to 25 cm long, these each bearing | to several hooks and sometimes a terminal rosette of leaves: hooks recurved to spiraling, 9-24 mm diam. Adult leaves drying chartaceous to coriaceous, on both surfaces dull to shiny, in life not seen, when dry usually somewhat discolorous, dark brown above, lighter brown below, or sometimes concolorous and gray-lan on both sides: pits dimorphic, small pits sparsely scattered on abaxial surface, sparsely distributed and concentrated near midrib and margins on adaxial surface, large pits 0.3-1.0 mm diam., circular to oval, rare on both surfaces; midrib adaxlally plane to shallowly sulcate, abaxially prominent, sometimes terminating in a tiny gland: secondary veins prominulous on both surfaces: tertiary veins reticulated, prominulous adaxially, nearly plane to prominulous abaxially; margins plane to shortly revolute; stem leaves with persistence unknown, elliptic to obovate, 5.5-23.1 * 2.6-8.8 em, L/W 2.0-4.1, at apex obtuse to rounded, at base truncate to cuneate; secondary veins 4 to 11 pairs, with intramarginal vein situated 2—4 mm from margin; leaves at branchlet apices with persistence unknown, oblanceolate to obovate, 7.2-33.0 X 3.09.4 em, L/W 2.3-4.8, at apex shortly and acutely or obtusely acuminate to obtuse or rounded, at base attenuate or abruptly narrowly contracted (i.e., pseudopetiolate); secondary veins 7 to 16 pairs, with intramarginal vein situated 2-4 mm from margin. Inflorescence lax, paniculate, lateral or subterminal among leaves at apices of branchlets, along peduncle and primary axis occasionally with hooks (e.g.. Jones & Onochie in FHI 16641, P) or bracteal leaves similar to adult stem leaves (e.g., Gereau et al, 5603, MO); peduncle 1.5-8.0 cm long, straight; branched portion corymbiform, 5—15 X 12-20 em, dichotomously branched; bracts triangular-ovate, 0.8-1.6 X 0.5-1.0 mm, at apex acute to obtuse, at base obtuse, marginally entire, abaxially with a discoid gland covering ca. % the surface, occasionally also with | or 2 poorly defined pits near base: pedicels 2-5 mm long. Flowers all pedicellate; sepals 5, oblong to elliptic-oblong, rounded and entire at apex, at base truncate and shortly decurrent on ovary, light green tinged red-purple, abaxially sometimes with 1 to 4 pit-like glands, adaxially with small pits, unequal, larger 3 sepals 3.5-5.1 X 1.4— 2.5 mm, shorter 2 sepals 3.2-4.2 X 2.0-2.9 mm: petals 5, imbricate, oblong-obovate, pale yellow tinged pink, ca. 8.1 X 3.2 mm; stamens 10 in 2 whorls; filaments slender, a little dimorphic, the shorter ca. 4.5 mm long, the longer ca. 5.0 mm long; anthers 0.8-1.0 mm long; ovary ca. % inferior, 1-2 mm long; styles 3, ca. 5 mm long, stigmas ca.
0.4 X 0.9 mm. Fruit turbinate: nut 5-8 X 3-6 mm, on sides longitudinally shallowly 5-ridged by decurrent margins of accrescent sepals; persistent sepal limbs spreading, papyraceous, dark red, unequal, the larger spathulate to oblanceolate, 28—42 * 13-16 mm, the smaller oblong-spathulate, (5—) 12-16 X (4—)5-6 mm; pericarp drying brown, coriaceous: seed not seen.",1,https://www.biodiversitylibrary.org/page/27274348
"Distribution, phenology, and habitat. In evergreen vegetation at 80-600 m, including on open roadsides and along rivers, Nigeria to Gabon: collected in flower in March and November, in fruit in February and September.",0,https://www.biodiversitylibrary.org/page/27274348
"With an EO greater than 20,000 km? and existing in Cameroon, Provisional conservation status.",0,https://www.biodiversitylibrary.org/page/27274348
"Gabon, and Nigeria: Least Concern; with far fewer",0,https://www.biodiversitylibrary.org/page/27274348
"396 Annals of the Missouri Botanical Garden of Arts, Sciences, and Literature. Longman, Hurst, Rees, Orme, & Brown, London, XX vols.",0,https://www.biodiversitylibrary.org/page/27274362
"Rottbgll, C. F. 1783. Biskrivelse over nogle Planter fra de malabariske Kyster. Nye Saml. Kongel. Danske Vidensk. Selsk. Skr. 2: 525-546.",0,https://www.biodiversitylibrary.org/page/27274362
"Scott-Elliot, G. F. 1894. On the botanical results of the Sierra Leone Boundary Commission. J. Linn. Soc., Bot.
30: 64-100.",0,https://www.biodiversitylibrary.org/page/27274362
"Stearn, W. T. 1992.
Charles, London.",0,https://www.biodiversitylibrary.org/page/27274362
"Steenis, C. G. G. J. van. 1948. Ancistrocladaceae. In: C.
G. G. J. van Steenis (editor), Flora Malesiana 4: 8-10.
Noordhoff-Kolff N.V., Jarkarta.",0,https://www.biodiversitylibrary.org/page/27274362
"Stevens, P. F. (consulted Aug. 2004), Angiosperm Phylogeny Website. Version 4, May 2003 [and more or less continuously updated since]. <http://www.mobot.org/ MOBOT/research/A Pweb/>.",0,https://www.biodiversitylibrary.org/page/27274362
"Takhtajan, A. 1986. Floristic Regions of the World. Univ.
California Press, Berkeley.",0,https://www.biodiversitylibrary.org/page/27274362
"Botanical Latin, 4th ed. David & Thomas, D. W. & R. E. Gereau. 1993. Ancistrocladus korupensis (Ancistrocladaceae): A new species of liana from Cameroon. Novon 3: 494-498.",0,https://www.biodiversitylibrary.org/page/27274362
"Thwaites, G. H. K. 1849. XXV. Note on the genus Ancistrocladus of Wallich. Trans. Linn, Soc. London 21: 225-226, |unpaginated] figs. 1-18.",0,https://www.biodiversitylibrary.org/page/27274362
"Tieghem, P. van. 1903. Sur les Ancistrocladacées. J. Bot.
(Morot) 17: 151-168.",0,https://www.biodiversitylibrary.org/page/27274362
"Vahl, M. 1810. Beskrivelse over nye Planteslaegter. Skr.
Naturhist.-Selsk. 6: 84-128.",0,https://www.biodiversitylibrary.org/page/27274362
"Wallich, N. 1829. A numerical list of dried specimens of plants, in the East India Companys Museum collected under the superintendence of Dr. Wallich of the Company’s botanic garden at Calcutta, nos. 1-2153. Lithographed manuscript, London.",0,https://www.biodiversitylibrary.org/page/27274362
"Walpers, W. G. 1851. Annales Botanices Systematicae, Vol. 2. Frederic Hoffmeister, Leipzig.",0,https://www.biodiversitylibrary.org/page/27274362
"Wight, R. 1853. Icones Plantarum Indiae Orientalis 6: t.
1987-1988.",0,https://www.biodiversitylibrary.org/page/27274362
APPENDIX I. KEYS TO ANCISTROCLADUS SPECIES BY CONTINENT 1. KEY TO SPECIES OF ANCISTROCLADUS IN ASIA la. Stamens 5; fruit with nut body ca. 20 X 15-19 mm; plants of Sri Lanka 9. A. hamatus (Vahl) Gilg lb. Stamens 10 to 15 (number unknown in A. griffithii); fruit with nut body 5-10 X 5-14 mm; plants of continental Asia and islands east of Sri Lanka.,0,https://www.biodiversitylibrary.org/page/27274362
"2a, Fruit with accrescent sepals subequal, 5-15 * 4—8 mm; branchlet leaves 10.0-45.0 * 1.5—5.4 em, with L/W 4.3-11.5.",1,https://www.biodiversitylibrary.org/page/27274362
"3a. Branchlet leaves with secondary veins plane on adaxial surface, very slightly prominulous on abaxial 3b.",1,https://www.biodiversitylibrary.org/page/27274362
