text,is_desc,url
"Eleocharis subg. Limnochloa Eleocharis cellulosa and E. quadrangulata belong to subg. Limnochloa, a group of over 35 species distributed throughout tropical and subtropical regions worldwide, most being robust emergent plants forming extensive stands in wetlands. Species in the subgenus are readily distinguished from other spikerushes by a combination of cartilaginous floral scales with prominent longitudinal veins, culms that are usually as thick as the cylindrical spikelets, and biconvex (or rarely trigonous) achenes with usually large polygonal epidermal cells arranged in longitudinal rows (Gonzalez-Elizondo & Peterson 1997). Identification of species in this group relies on features of",0,https://www.biodiversitylibrary.org/page/47870704
"Ruiz-Guerrero et al.: Flora of La Gudsima, southem Sinaloa ASPARAGACEAE (includes Agavaceae, Liliaceae) Agave americana L.",0,https://www.biodiversitylibrary.org/page/49470811
Agave angustifolia Haw. var. rubescens (Salm-Dyck) Gentry Agave impressa Gentry Agave ornithobroma Gentry Agave vilmoriniana A. Berger Bessera elegans Schult. f.,0,https://www.biodiversitylibrary.org/page/49470811
"Manfreda jaliscana Rose BROMELIACEAE Aechmea bracteata (Sw.) Griseb. var. pacifica Beutelsp.
Bromelia plumieri E. Morren [new name for Bromelia karatas L.] Pitcairnia palmeri S. Wats.",0,https://www.biodiversitylibrary.org/page/49470811
Tillandsia capitata Griseb.,0,https://www.biodiversitylibrary.org/page/49470811
Tillandsia caput-medusae E. Morren Tillandsia caput-medusae E. Morren x Ff. mazatlanensis Rauh Tillandsia fasciculata Sw.,0,https://www.biodiversitylibrary.org/page/49470811
Tillandsia ionantha Planch.,0,https://www.biodiversitylibrary.org/page/49470811
Tillandsia recurvata (L.) L.,0,https://www.biodiversitylibrary.org/page/49470811
Tillandsia schiedeana Steud.,0,https://www.biodiversitylibrary.org/page/49470811
"COMMELINACEAE Callisia filiformis (Mart. & Gal.) D.R. Hunt Callisia monandra (Sw.) Schult. & Schult. f.
Commelina diffusa Burm. f.",0,https://www.biodiversitylibrary.org/page/49470811
Commelina erecta L.,0,https://www.biodiversitylibrary.org/page/49470811
"Tinantia longipedunculata Standl. & Steyerm.
Tinantia macrophylla S. Wats.",0,https://www.biodiversitylibrary.org/page/49470811
COSTACEAE Costus sp.,0,https://www.biodiversitylibrary.org/page/49470811
CYPERACEAE Bulbostylis vestita (Kunth) C.B. Clarke Cyperus amabilis Vahl Cyperus canus J. Presl & C. Presl Cyperus compressus L.,0,https://www.biodiversitylibrary.org/page/49470811
Cyperus dentoniae GC. Tucker Cyperus entrerianus Boeck.,0,https://www.biodiversitylibrary.org/page/49470811
Cyperus fugax Liebm.,0,https://www.biodiversitylibrary.org/page/49470811
Cyperus haspan L.,0,https://www.biodiversitylibrary.org/page/49470811
Cyperus iria L.,0,https://www.biodiversitylibrary.org/page/49470811
Cyperus ischnos Schltdl.,0,https://www.biodiversitylibrary.org/page/49470811
Cyperus mutisii Kunth) Andersson Cyperus rotundus L.,0,https://www.biodiversitylibrary.org/page/49470811
Cyperus surinamensis Rottb.,0,https://www.biodiversitylibrary.org/page/49470811
"Cyperus tenerrimus J. Presl & C. Presl Dichromena linkii J.F. Macbr. [new name for Rhynchospora tenuis Willd. ex Link] Fimbristylis annua (All.) Roem. & Schult.
Fimbristylis decipiens Kral TSF 22",0,https://www.biodiversitylibrary.org/page/49470811
"Singhurst et al.: Uéricu/aria cornuta in Arkansas and Oklahoma 3 In Calhoun County, Arkansas, Utricularia cornuta occurred scattered patches over an 0.5 x 3 meter area on wet mineral soils in an open herbaceous seepage wetland at the topographic break between the ""Intermediate Terrace"" and ""Prairie Terrace"" geomorphic surfaces of the Pleistocene Fluvial Terraces (EPA Level IV) Ecoregion (a series of ancient terraces of the Saline and Ouachita Rivers). Seven plants of U. cornuta were observed in full flower. Associated species include Cyperus haspan, Dichanthelium scabriusculum, Doellingeria sericocarpoides, Eleocharis tortilis, Eriocaulon decangulare, Eryngium integrifolium, Eupatorium rotundifolium, Fuirena bushii, Helianthus angustifolius, Juncus spp., Lycopodiella appressa, Mitreola sessilifolia, Myrica heterophylla, Osmunda regalis, Paspalum laeve, Paspalum praecox, Platanthera cristata, Pluchea foetida, Polygala nana, Pseudolycopodiella caroliniana, Rhexia mariana, R. virginica, Rhynchospora glomerata, R. gracilenta, R. inexpansa, R. rariflora, Scleria muehlenbergii, Sisyrinchium atlanticum, Sphagnum spp., Utricularia gibba, Woodwardia areolata, Woodwardia virginica, Xyris ambigua, Xyris baldwiniana, and Xyris torta.",0,https://www.biodiversitylibrary.org/page/46547914
"In Pushmataha County, Utricularia cornuta appears restricted to Oklahoma Acidic Hillside Seeps (Nature Serve 2014) surrounded by the Antlers Sand Formation. These hillside seeps are highly localized and isolated wetlands in southeast Oklahoma that include a number of disjunct West Gulf Coastal Plain flora at their northwest range limits. Oklahoma Acidic Hillside Seep dominant species include Andropogon virginicus, Dichanthelium scoparium, Boehmeria cylindrica, Sphagnum spp., and Polytrichum commune. Other characteristic flora of the two hillside seeps include Baccharis halimifolia, Drosera brevifolia, Carex spp., Cyperus strigosus, Eleocharis tortilis, Eriocaulon decangulare, Eupatorium perfoliatum, E. rotundifolium, Gratiola pilosa, Hydrolea ovata, Juncus validus, Helianthus angustifolius, Lycopodiella appressa, Ludwigia hirtella, Mitreola petiolata, Osmunda cinnamomea, O. regalis, Oxypolis rigidior, Pluchea foetida, Rhexia mariana, R.
virginica, Rhynchospora caduca, R. gracilenta, R. rariflora, Rubus argutus, Scleria sp., Utricularia juncea, U. subulata, Xyris difformis, and X. jupicai. The U. cornuta population is restricted to a 1 m x 1 meter patch along a perennial seep run.",0,https://www.biodiversitylibrary.org/page/46547914
,0,https://www.biodiversitylibrary.org/page/46547914
"386 Rhodora [OcropEeR hours for low tide were between 7 and 10 in the evening and 5 and 8 in the morning! But to return to Powhatan Creek, northwest of Jamestown. The most obvious plant as we came to the tidal marsh was Eryngium aquaticum and we soon learned to expect it on every tidal marsh. Cyperus haspan, var. americanus Boeckel. (Map 9), likewise, tropical and warm-temperate American representative of a pantropical species, was there and on most other such marshes, and so was the giant flaccid-leaved variety of Rhynchospora macrostachya. In Ruopora, xli. 533 (1939), I noted the occurrence of the species on the tidal mud of the James and the Chickahominy, whereas in the Great Dismal Swamp and in most regions it is a species of acid peat. The plant of many river-estuaries of Virginia is uniform in its thin and flaccid, greatly elongate leaves and its great stature (up to 1.75 m. high), and Miss Gale finds distinctive characters in the achenes. It will be further discussed in Part II. On the mud at extreme low tide were Hriocaulon Parkeri (map 17), whose Virginia citizenship has rested only on a collection of Grimes’s on the Chickahominy, Sagittaria subulata (typical) and Elatine americana (Map 18), the first from south of the estuary of the Delaware. When the incoming tide finally drove us back into the woods, there was Scirpus fluviatilis Harper, var. virginiana Fernald in Ruopora, xli. 532 (1939), which we had known only south of the James.",0,https://www.biodiversitylibrary.org/page/607590
"Forced out by high tide at Powhatan Creek, we drove westward and finally tried the shore at Wilcox Wharf on the James.
The water was pretty high but we were there particularly impressed by a demonstration (discussed in Part II) of the transition from Panicum agrostoides to P. condensum. But the great prize was a repent plant of the Commelinaceae, quite strange to us. It was still very young, not beginning to flower. We were completely puzzled by it, for it did not belong either to Commelina or to Tradescantia. The spot was, consequently, carefully noted for a visit in September.",0,https://www.biodiversitylibrary.org/page/607590
Long Island in Back Bay had supplied so many novelties that we wanted to return there. Miss Ryan and Miss Leigh had gone to the mountains; but we arranged with Mr. Bailey at the Pungo camp to get us out to the Island or the islands for the 24th and 25th. We did not then know that the conservation of,0,https://www.biodiversitylibrary.org/page/607590
"1940] Fernald,—Additions to Flora of Virginia 505 migrate from river to river along fresh or brackish (not strongly saline) shores.",0,https://www.biodiversitylibrary.org/page/607737
"Such conditions today prevail in a region like Back Bay in southeastern Virginia, where the off-shore bars and continuous dunes of the outer shore shut in a shallow body of tidal waters, perpetually renewed by fresh streams or seepage, and with the nearest inlet from the open sea far below the Virginia-North Carolina line. Rarely, during wild storms, sea-water dashes from the outside Atlantic into sheltered Back Bay; and sufficient salinity has been preserved in some of the marshes to maintain a few specially tolerant halophytes. The shores of Back Bay and the fresh pools and ponds on its margins or on Long Island are, however, the homes of such notable plants of the fresher marshes and waters as Cyperus haspan var. americanus (MAP 9), the American representative of a pantropical species (tropical and warm-temperate North and South America, Africa and warmer regions of Asia and Australia). The world-range of the species is suggestive of that of Cyperus brevifolius (map 21).
Other typical plants of the freshish marshes of Back Bay are endemics of the two Americas; such, for instance, as Typha truaillensis (MAP 8), with details of distribution somewhat different from those of the two species of Cyperus and an ability, through its coma of perianth-bristles, to spread, locally, away from the slightly brackish marshes (where it rarely persists). Others are endemics of the southeastern United States. A good example is Juncus megacephalus (Map 5), a very distinet species which occurs in the fresh to brackish marshes from Texas to the shores of Back Bay. Its habitats, as given on such labels as clearly indicate them, are as follows: ditch (La.), wet sandy shores (Fla.), mucky ground (Fla.), flatwood ponds (Fla.), prairie (Fla.), pineland (Fla.), low pinelands (Fla.), moist pine barrens (Ga.), low ground back of sand-dunes (Ga.), lime-sinks (Ga.), savannah (S. C.), dune-hollows (S. C.), river-marsh (S. C.), salt meadow (N. C.), marsh (N. C.), dune-hollow (Va.), swale back of dunes (Va.), inner border of brackish to fresh marsh (Va.).
In brief, Juncus megacephalus, like its associates, is not a pronounced halophyte; we do not find it, like J. Roemerianus, for instance, following the salt marshes. It is not a plant of the saline outer coast but rather of the fresh to barely brackish inner",0,https://www.biodiversitylibrary.org/page/607737
1975] Belize Monocotyledoneae — Spellman et al. 119 T. geniculatum Jacq. — P 30078 T. lundellii Stand.,0,https://www.biodiversitylibrary.org/page/659768
Tripogandra cumanensis (Kunth) Woodson — P 30153 T. grandiflora (D. Sm.) Woodson —H 399; K 592; P 29692; Sp 2008 T. serrulata (Vahl) Handlos — C 23717; G 7981 Zebrina pendula Schnizl.,0,https://www.biodiversitylibrary.org/page/659768
"Cyclanthaceae Asplundia chiapensis (Mart.) Harl.
Carludovica palmata R. & P.
C. utilis (Oerst.) Benth. & Hook.",0,https://www.biodiversitylibrary.org/page/659768
"Cyperaceae * Abildgaardia ovata (Burm.f.) Kral — D 11050 Bulbostylis arenaria (Nees) Lindm. —H 189; P 29431 B. capillaris (.) C.B. Clarke B. junciformis (H.B.K.) Lindm. —H sn; H 15; H 244 B. paradoxa (Spreng.) Lindm.—D & P 10124; H 81; P 29432 B. tenuifolia (Rudge) Macbr. — C 23962 B. vestita (Kunth) C.B. Clarke — D 11608; H 18 Calyptrocarya glomerulata (Brong.) Urban — G 8595 Carex polystachya Sw. ex Vahl var. bartletti (O’Neill) Standl. & Steyermark — H 248; P 29647 Cladium jamaicense Crantz—C 23296; C 24995; D 12642; DEM 629; Dieck 294; G 8527; Sp & St 2239 Cyperus articulatus L.
C. brevifolius (Rottb.) Endl. ex Hassk.
C. compressus L.
C. cyperoides (L.) Kuntze — H 283 C. diffusus Vahl — C 24865; G 7997; G 8032; G 8443 C. digitatus Roxb. — P 29926 C. eggersti Boeck.
C. elegans L.
C. esculentus L.
C. flavus (Vahl) Nees C. haspan L.—C 238915; C 23998; C 24865; D 10756; H 100; P 29675; P 29716",0,https://www.biodiversitylibrary.org/page/659768
2004 | Ritter-—Too Wet For Aquatic Plants? 31 SPHENOCLEACEAE. = Sphenoclea zeylanica Gaertn. — Emergent herb; GC/R.,0,https://www.biodiversitylibrary.org/page/32864548
"VITACEAE. Cissus erosa Rich. — Climber; GC/LA N. Ritter 1694 (BOLV, LPB, MO, NHA, W).",0,https://www.biodiversitylibrary.org/page/32864548
"LILIOPSIDA (Monocotyledons) ALISMATACEAE. = Echinodorus ct. subalatus (Mart.) Griseb. — Emergent herb; SF/O N. Ritter 1617 (BOLV, LPB, MO, NHA, UNA).",0,https://www.biodiversitylibrary.org/page/32864548
ARACEAE. Pistia Stratiotes L. — Free-floating herb; GC/NN.,0,https://www.biodiversitylibrary.org/page/32864548
"COMMELINACEAE. Commelina sp. — Emergent herb; MW/NN N. &Aiftter 1442 (BOLY, MO, NHA).",0,https://www.biodiversitylibrary.org/page/32864548
"COSTACEAE. Costus arabicus L. — Emergent herb; IM/F N. Ritter 3152 (BOLV. Mo, NHA). Costus scaber Ruiz & Pav. — Emergent herb; GC/NN.",0,https://www.biodiversitylibrary.org/page/32864548
"CYPERACEAE. Calyptrocarya glomerulata (Brongn.) Urb. — Emergent herb; MW/LA N. Ritter & G.E. Crow 2305 (BOLV, MO, NHA. W). Cyperus aggregatus (Willd.) Endl. — Emergent herb; GC/LA N. Ritter 38/0 (BOLY, LPB, MO, NHA, W).
Cyperus haspan L. — Emergent herb; MW/F, IM/RN. Ritter [635 (BOLV, MO, NHA, W).
Cyperus luzulae Hochst. ex Steud. — Emergent herb; IM/O, SF/C, VT/CN. Ritter 3834 (BOLV, MO, NHA). Cyperus meyenianus Kunth — Emergent herb; MW/R, IM/C, SF/O N.
Ritter 3814 (BOLY, LPB, MO, NHA, W). Cyperus surinamensis Rottb. — Emergent herb; SP/ FN. Ritter 1394 (BOLV, MO, NHA). Diplacrum longifolium (Griseb.) C. B. Clarke — Emergent herb; MW/F N. Ritter /630 (BOLV. MO, NHA, W). Diplasia karataefolia Rich. — Emergent herb; MW/R N. Ritter & G.E. Crow 2307 (BOLY, MO, NHA, W). Eleocharis acutangula (Roxb.) Schult. — Floating mat-forming herb; IM/A N. Ritter 2979 (BOLY, LPB, MO, NHA, W). Eleocharis elegans (Kunth) Roem. & Schult. - Emergent herb; GC/O N. Ritter 3135 (BOLV.MO.NHA). Eleocharis interstincta R. Br. — Emergent herb; MW/A N. Ritter 1433 (BOLV.MO.NHA). Fimbristylis dichotoma (L.) Vahl — Emergent herb; IM/ LA, GC/C_N. Ritter 1704 (BoLV, MO, NHA, W). Fimbristylis littoralis Gaudich. — Emergent herb; GC/F N. Ritter 2978S (BOLV, LPB, MO, NHA, W). Oxycaryum cubense (Poepp. & Kunth) Lye — Floating mat-forming herb; IM/O N. Ritter 3/65 (BOLV, NHA).
Scleria cyperinoides Clark — Emergent herb; MW/C_N. Ritter & G.E. Crow 2299 (BOLYV, MO, NHA). Scleria macrophylla J. Pres| & C. Pres] — Emergent herb; MW/LA, SF/C, GC/C N. Ritter 3150 (BOLV. LPB, MO, NHA). Scleria microcarpa Nees ex Kunth — Emergent herb; SF/O, VT/A WN. Ritter 1402 (BOLYV, MO, NHA, W).",0,https://www.biodiversitylibrary.org/page/32864548
"ERIOCAULACEAE. Tonina fluviatilis Aubl. — Emergent herb; MW/A N. Ritter 1443 (BOLV, LPB, MO, NHA).",0,https://www.biodiversitylibrary.org/page/32864548
"HELICONIACEAE. HHeliconia marginata (Griggs) Pittier — Emergent herb; SC/A N.
Ritter 1686 (BOLY, LPB, MO, NHA).",0,https://www.biodiversitylibrary.org/page/32864548
"HYDROCHARITACEAE. Apalanthe granatensis (Humb. & Bonpl.) Planch. — Submersed herb: SF/A N. Ritter 1627 (BOLV. LPB. MO, NHA. W). Limnobium laevigatum (Humb. & Bonpl. ev Willd.) Heine — Free-floating herb: GC/NN.",0,https://www.biodiversitylibrary.org/page/32864548
"1080 malha de 2 mm. As analises foram realizadas no Laboratério de Manejo e Conservagao de Solos, do Instituto de Ciéncias Agrarias da Universidade Federal de Uberlandia, de acordo com método preconizado pela Embrapa (1979).",0,https://www.biodiversitylibrary.org/page/51130607
"A declividade, da borda em relagao ao fundo das seis veredas estudadas foi determinada por Ramos (2004).",0,https://www.biodiversitylibrary.org/page/51130607
"Para verificar a ocorréncia de diferengas no numero de espécies entre as zonas de borda, meio e fundo das veredas foi utilizada a ANOVA em blocos casualizados (Zar 1996), Para a andlise da distribuigao da flora entre as seis veredas e entre as zonas de borda, meio e fundo das mesmas, foi utilizada a Andlise de Correspondéncia retificada (DCA), feita pelo programa PC-ORD versao 4.2 (McCune & Mefford 1999), a partir de uma matriz de presenga e auséncia de espécies.",0,https://www.biodiversitylibrary.org/page/51130607
"RESULTADOS Nas seis dreas de veredas estudadas, foram encontradas 436 espécies, distribufdas em 206 géneros, pertencentes a 59 familias botanicas. O maior nimero de espécies foi coletado na V1 (219 espécies) e 0 menor na V3 (146 espécies). A borda das veredas foi a menos rica em espécies e a zona do meio foi, em geral, a mais rica (v. Apéndice | na versao on-line desse artigo).",0,https://www.biodiversitylibrary.org/page/51130607
"As nove familias com maior nimero de espécies nas seis veredas representaram 63,7% do total de espécies amostradas. Essas familias tiveram espécies representadas nas trés zonas das veredas, embora Cyperaceae, Poaceae e Xyridaceae tenham ocorrido com maior riqueza nas zonas de meio e fundo, enquanto Asteraceae, Melastomataceae e Rubiaceae, na borda e meio. Vinte e oito familias tiveram de uma a duas espécies (Apéndice 1) e representaram 8.5% do total de espécies amostradas. Dentre essas familias, apenas oito possuem representantes em solo permanentemente inundado, no fundo das veredas, como por exemplo, Alismataceae, Arecaceae, Ericaceae e Aquifoliaceae. Sete das menos ricas, tais como Amaranthaceae, Aristolochiaceae, Oxalidaceae e Myrtaceae, nado Ocorreram em todas as veredas e tiveram Oliveira, G. C., Araujo, G. M. & Barbosa, A. A. A.",0,https://www.biodiversitylibrary.org/page/51130607
espécies exclusivas na borda (Apéndice 1) em solo mais seco.,0,https://www.biodiversitylibrary.org/page/51130607
"Quanto a distribuigdo das espécies nas zonas de borda, meio e fundo, Axonopus siccus, Echinolaena inflexa e Tibouchina gracilis ocorreram principalmente na borda, em pelo menos cinco veredas. Na zona de meio, em cinco das seis veredas foram amostradas as espécies Paspalum cordatum, Cyperus haspan, Xyris savanensis, Syngonanthus xeranthemoides e Schizachyrium condensatum, sendo Arthropogon filifolius exclusiva dessa zona em todas as veredas. Sete espécies ocorreram preferencialmente no fundo em cinco ou seis veredas, entre as quais Ascolepis brasiliensis, Otachyrium versicolor e Mauritia flexuosa. Eryngium ebracteatum e Xanthosoma striatipes foram algumas das poucas espécies que ocorreram exclusivamente no fundo em todas as veredas. Um nimero maior de espécies foi registrado na zona de meio e de fundo bem como no meio e borda, mas poucas ocorreram simultaneamente na borda e fundo (Apéndice 1).",0,https://www.biodiversitylibrary.org/page/51130607
"A ordenagio por DCA (Fig. 1a) mostrou, no primeiro eixo, variabilidade na composi¢ao floristica entre as veredas situadas em sedimentos de textura média arenosa (V1, V2 e V3) e as em superficie de textura muito argilosa (V4, V5, e V6). No eixo dois, ocorreu maior variabilidade entre as veredas situadas em sedimentos de textura média arenosa do que as que Ocorrem em textura muito argilosa.
Quanto a ordenacgao da composicao floristica nas trés zonas das veredas (Fig. 1b), 0 eixo um mostra um gradiente continuo, entre a zona mais seca das veredas (borda) e as mais timidas (meio e fundo) progressivamente da direita para a esquerda. O segundo eixo evidencia maior variabilidade floristica entre as zonas de borda, do que entre as de meio e fundo das veredas. A ANOVA para blocos casualizados mostrou diferengas significativas entre as zonas de borda, meio e fundo das veredas em relagdo ao nimero de espécies amostradas no levantamento floristico (F = 7,38; P=0,006).",0,https://www.biodiversitylibrary.org/page/51130607
"Rodriguésia 60 (4): 1077-1085. 2009 6 SCLELO/JBRU, 1s 24 th to Tet 28",0,https://www.biodiversitylibrary.org/page/51130607
"1940] Fernald—Additions to Flora of Virginia 509 Back Bay, which today presents ideal conditions for the local spread of species of fresh to brackish shores, is not like the typical fresh river-estuary. The fresh estuaries are found far up-stream from the mouths of the eastern Virginian rivers.
Those which have been explored by us are on the James and the Chickahominy and their tributaries, on the Pamunkey, the Mattaponi, and, to a lesser extent, on the Nottoway and the Blackwater. They are highly developed but only slightly explored (and that some years ago) on North Landing River. On the main River James the best of the fresh tidal marshes begin about 50 miles from its mouth and thence extend 25 miles upriver, but the smaller tributary creeks and the Chickahominy have good tidal marshes from near their mouths well up-stream, on the Chickahominy at least to Windsor Shades, The York is salt for more than 30 miles, up to Westpoint, at the confluence of the Pamunkey and the Mattaponi. The fresh tidal marshes on the Mattaponi follow that stream (often with broad tidalmarsh islands) about 30 miles, to the region of Walkerton. On the Pamunkey they are finely developed but we have not determined their extent. The Nottoway and the Blackwater unite at the North Carolina line to form the Chowan in North Carolina, reaching the sea via Albemarle Sound, which itself merges into Pamlico Sound, these sounds mostly cut off from the open Atlantic by a wonderful development of off-shore bars, sometimes 4 miles broad. Tidal conditions extend slightly into Virginia on the Nottoway; on the Blackwater they extend above Franklin. North Landing River, a sluggish tributary of Currituck Sound, thence to the sea through Albemarle and Pamlico Sounds, is bordered nearly its whole length by broad and fresh tidal marshes. Its mouth is more than 60 miles from the first opening to the Atlantic, at Oregon Inlet, on the outer coast of Dare County, North Carolina. The fresh tidal estuaries to which I am referring, are, then, anywhere from 30 miles (York River system) to 125 miles (Blackwater River) from the open Atlantic. They illustrate, very typically, the estuaries of Atlantic North America north to the St. Lawrence. On several or all of the Virginian estuaries examined a few of the species of Back Bay are found: Sagittaria falcata Pursh (Guatemala to Delaware and Maryland); Cyperus haspan var. americanus (MAP 9,",0,https://www.biodiversitylibrary.org/page/607741
"1939] Svenson,—Monographic Studies in the Genus Eleocharis 3 uniglumate condition of the lowest scale are not always dependable characters.",1,https://www.biodiversitylibrary.org/page/606461
EXLEOcHARIS: CONSPECTUS OF THE GENUS Series 1. MuTAaTAr.,0,https://www.biodiversitylibrary.org/page/606461
"1, E. fistulosa, 2, KE. nupeensis. 3, E. quadrangulata. 4, E. mutata.
5, E. cellulosa. 6, E. variegata. 7, E. laxiflora. 8, E. nuda. 9, E.
calocarpa. 10, E. spiralis. 11, E. interstincta. 12, E. equisetoides.
13, E. dulcis. 14, EK. sphacelata. 15, E. Robbinsii. 16, E. elongata.
17, EK. mitrata. 18, E. Jelskiana. 19, E. plicarhachis.",0,https://www.biodiversitylibrary.org/page/606461
"Series 2. PAUCIFLORAE.
20, E. pauciflora. 21, E. macrantha. 22, E. margaritacea. 23, E.
parvula, 24, E. rostellata. 25, E. melanomphala.",0,https://www.biodiversitylibrary.org/page/606461
Series 3. ACICULARES.,0,https://www.biodiversitylibrary.org/page/606461
"26, EK. exigua. 27, EK. radicans. 28, E. bonariensis. 29, E. stenocarpa.
30, E. nervata. 31, E. brachycarpa. 32, E. cancellata. 33, E. bella.
34, E. Reverchonii. 35, E. Wolfii. 36, E. acicularis. 37, E. pusilla.",0,https://www.biodiversitylibrary.org/page/606461
"Series 4. OVATAE.
38, E. obtusa. 39, E. ovata. 40, E. Engelmanni. 41, E. lanceolata.",0,https://www.biodiversitylibrary.org/page/606461
Series 5. MAcULOSAE.,0,https://www.biodiversitylibrary.org/page/606461
"42, KE. maculosa. 43, E. fuscopurpurea. 44, E. debilis. 45, E. bahamensis. 46, E. atropurpurea. 47, E. capillacea. 48, E. Sellowiana.
49, IX. Schaffneri. 50, KE. olivacea. 51, E. flavescens. 52, E. Sintenisii.
53, Ei. geniculata. 54, E. minuta. 55, E. intricata.",0,https://www.biodiversitylibrary.org/page/606461
Series 6. PALUSTRIFORMES.,0,https://www.biodiversitylibrary.org/page/606461
Sub-series: PALUSTRES.,0,https://www.biodiversitylibrary.org/page/606461
"56, i. palustris. 57, EK. mamillata. 58, E. macrostachya. 59, E. neozeylandica. 60, E. melanostachys. 61, E. Dregeana. 62, E. mitracarpa.
63, E. Savatierl. 64, E. calva. 65, E. Smallii. 66, E. ambigens. 67, E.
halophila. 68, E. uniglumis. 69, E. kamtschatica.",0,https://www.biodiversitylibrary.org/page/606461
Sub-series: TRuNcaTAE (North American).,0,https://www.biodiversitylibrary.org/page/606461
"70, i. elliptica. 71, E. tenuis. 72, E. compressa. 73, E. nitida. 74, Ki. acutisquamata. 75, E. tricostata. 75a, E. cylindrica. 76, E. Bolanderi. 77, . Palmeri. 78, EK. decumbens. 79, E. Parishii. 80, E. intermedia. 81, E. Macounii.",0,https://www.biodiversitylibrary.org/page/606461
Sub-series: TRUNCATAE (chiefly South American).,0,https://www.biodiversitylibrary.org/page/606461
"82, I. Dombeyana. 83, E. crinalis. 84, E. Rabenii. 85, E. albibracteata. 86, EX. montevidensis. 87, E. nodulosa. 88, E. Parodii. 89, E.
elegans. 89a, E. densa. 90, E. Lechleri. 91, E. mendocina. 92, E.
Spegazzinii. 93, E. Haumaniana.",0,https://www.biodiversitylibrary.org/page/606461
